vllm/lora/ops/triton_ops/lora_configs/qwen3-32B-swizzle-expand/NVIDIA_H200_SHRINK.json
{
    "16": {
        "1": {
            "1": {
                "2048": {
                    "32": {
                        "block_m": 16,
                        "block_n": 32,
                        "block_k": 32,
                        "num_warps": 4,
                        "num_ctas": 1,
                        "num_stages": 2,
                        "split_k": 64
                    },
                    "64": {
                        "block_m": 16,
                        "block_n": 32,
                        "block_k": 32,
                        "num_warps": 4,
                        "num_ctas": 1,
                        "num_stages": 3,
                        "split_k": 32
                    },
                    "16": {
                        "block_m": 16,
                        "block_n": 32,
                        "block_k": 32,
                        "num_warps": 4,
                        "num_ctas": 1,
                        "num_stages": 5,
                        "split_k": 64
                    },
                    "128": {
                        "block_m": 16,
                        "block_n": 64,
                        "block_k": 64,
                        "num_warps": 8,
                        "num_ctas": 1,
                        "num_stages": 2,
                        "split_k": 32
                    }
                },
                "6400": {
                    "32": {
                        "block_m": 16,
                        "block_n": 32,
                        "block_k": 64,
                        "num_warps": 4,
                        "num_ctas": 1,
                        "num_stages": 3,
                        "split_k": 64
                    },
                    "64": {
                        "block_m": 16,
                        "block_n": 32,
                        "block_k": 64,
                        "num_warps": 4,
                        "num_ctas": 1,
                        "num_stages": 5,
                        "split_k": 64
                    },
                    "16": {
                        "block_m": 16,
                        "block_n": 32,
                        "block_k": 64,
                        "num_warps": 4,
                        "num_ctas": 1,
                        "num_stages": 2,
                        "split_k": 64
                    }
                },
                "1024": {
                    "64": {
                        "block_m": 16,
                        "block_n": 64,
                        "block_k": 32,
                        "num_warps": 8,
                        "num_ctas": 1,
                        "num_stages": 3,
                        "split_k": 32
                    }
                },
                "3200": {
                    "64": {
                        "block_m": 16,
                        "block_n": 32,
                        "block_k": 64,
                        "num_warps": 4,
                        "num_ctas": 1,
                        "num_stages": 3,
                        "split_k": 32
                    }
                }
            },
            "2": {
                "2048": {
                    "32": {
                        "block_m": 16,
                        "block_n": 32,
                        "block_k": 64,
                        "num_warps": 4,
                        "num_ctas": 1,
                        "num_stages": 2,
                        "split_k": 32
                    },
                    "64": {
                        "block_m": 16,
                        "block_n": 64,
                        "block_k": 64,
                        "num_warps": 4,
                        "num_ctas": 1,
                        "num_stages": 3,
                        "split_k": 32
                    },
                    "16": {
                        "block_m": 16,
                        "block_n": 32,
                        "block_k": 32,
                        "num_warps": 4,
                        "num_ctas": 1,
                        "num_stages": 4,
                        "split_k": 64
                    },
                    "128": {
                        "block_m": 16,
                        "block_n": 32,
                        "block_k": 32,
                        "num_warps": 4,
                        "num_ctas": 1,
                        "num_stages": 3,
                        "split_k": 32
                    }
                },
                "6400": {
                    "32": {
                        "block_m": 16,
                        "block_n": 32,
                        "block_k": 64,
                        "num_warps": 4,
                        "num_ctas": 1,
                        "num_stages": 3,
                        "split_k": 64
                    },
                    "64": {
                        "block_m": 16,
                        "block_n": 64,
                        "block_k": 64,
                        "num_warps": 4,
                        "num_ctas": 1,
                        "num_stages": 3,
                        "split_k": 32
                    },
                    "16": {
                        "block_m": 16,
                        "block_n": 32,
                        "block_k": 32,
                        "num_warps": 4,
                        "num_ctas": 1,
                        "num_stages": 4,
                        "split_k": 64
                    }
                },
                "1024": {
                    "64": {
                        "block_m": 16,
                        "block_n": 32,
                        "block_k": 32,
                        "num_warps": 4,
                        "num_ctas": 1,
                        "num_stages": 4,
                        "split_k": 32
                    }
                },
                "3200": {
                    "64": {
                        "block_m": 16,
                        "block_n": 64,
                        "block_k": 64,
                        "num_warps": 4,
                        "num_ctas": 1,
                        "num_stages": 2,
                        "split_k": 64
                    }
                }
            },
            "4": {
                "2048": {
                    "32": {
                        "block_m": 16,
                        "block_n": 32,
                        "block_k": 32,
                        "num_warps": 4,
                        "num_ctas": 1,
                        "num_stages": 3,
                        "split_k": 32
                    },
                    "64": {
                        "block_m": 16,
                        "block_n": 64,
                        "block_k": 64,
                        "num_warps": 8,
                        "num_ctas": 1,
                        "num_stages": 2,
                        "split_k": 32
                    },
                    "16": {
                        "block_m": 16,
                        "block_n": 32,
                        "block_k": 32,
                        "num_warps": 4,
                        "num_ctas": 1,
                        "num_stages": 4,
                        "split_k": 32
                    },
                    "128": {
                        "block_m": 16,
                        "block_n": 32,
                        "block_k": 32,
                        "num_warps": 4,
                        "num_ctas": 1,
                        "num_stages": 4,
                        "split_k": 16
                    }
                },
                "6400": {
                    "32": {
                        "block_m": 16,
                        "block_n": 32,
                        "block_k": 64,
                        "num_warps": 4,
                        "num_ctas": 1,
                        "num_stages": 2,
                        "split_k": 64
                    },
                    "64": {
                        "block_m": 16,
                        "block_n": 64,
                        "block_k": 32,
                        "num_warps": 4,
                        "num_ctas": 1,
                        "num_stages": 3,
                        "split_k": 64
                    },
                    "16": {
                        "block_m": 16,
                        "block_n": 32,
                        "block_k": 64,
                        "num_warps": 4,
                        "num_ctas": 1,
                        "num_stages": 2,
                        "split_k": 64
                    }
                },
                "1024": {
                    "64": {
                        "block_m": 16,
                        "block_n": 64,
                        "block_k": 64,
                        "num_warps": 4,
                        "num_ctas": 1,
                        "num_stages": 2,
                        "split_k": 16
                    }
                },
                "3200": {
                    "64": {
                        "block_m": 16,
                        "block_n": 64,
                        "block_k": 64,
                        "num_warps": 4,
                        "num_ctas": 1,
                        "num_stages": 2,
                        "split_k": 64
                    }
                }
            },
            "8": {
                "2048": {
                    "32": {
                        "block_m": 16,
                        "block_n": 32,
                        "block_k": 64,
                        "num_warps": 4,
                        "num_ctas": 1,
                        "num_stages": 2,
                        "split_k": 32
                    },
                    "64": {
                        "block_m": 16,
                        "block_n": 64,
                        "block_k": 32,
                        "num_warps": 4,
                        "num_ctas": 1,
                        "num_stages": 3,
                        "split_k": 32
                    },
                    "16": {
                        "block_m": 16,
                        "block_n": 32,
                        "block_k": 64,
                        "num_warps": 4,
                        "num_ctas": 1,
                        "num_stages": 2,
                        "split_k": 32
                    },
                    "128": {
                        "block_m": 16,
                        "block_n": 64,
                        "block_k": 32,
                        "num_warps": 4,
                        "num_ctas": 1,
                        "num_stages": 3,
                        "split_k": 16
                    }
                },
                "6400": {
                    "32": {
                        "block_m": 16,
                        "block_n": 32,
                        "block_k": 32,
                        "num_warps": 4,
                        "num_ctas": 1,
                        "num_stages": 3,
                        "split_k": 32
                    },
                    "64": {
                        "block_m": 16,
                        "block_n": 64,
                        "block_k": 32,
                        "num_warps": 4,
                        "num_ctas": 1,
                        "num_stages": 3,
                        "split_k": 32
                    },
                    "16": {
                        "block_m": 16,
                        "block_n": 32,
                        "block_k": 64,
                        "num_warps": 4,
                        "num_ctas": 1,
                        "num_stages": 3,
                        "split_k": 32
                    }
                },
                "1024": {
                    "64": {
                        "block_m": 16,
                        "block_n": 32,
                        "block_k": 32,
                        "num_warps": 4,
                        "num_ctas": 1,
                        "num_stages": 2,
                        "split_k": 16
                    }
                },
                "3200": {
                    "64": {
                        "block_m": 16,
                        "block_n": 64,
                        "block_k": 128,
                        "num_warps": 4,
                        "num_ctas": 1,
                        "num_stages": 2,
                        "split_k": 32
                    }
                }
            },
            "16": {
                "2048": {
                    "32": {
                        "block_m": 16,
                        "block_n": 32,
                        "block_k": 32,
                        "num_warps": 4,
                        "num_ctas": 1,
                        "num_stages": 4,
                        "split_k": 16
                    },
                    "64": {
                        "block_m": 16,
                        "block_n": 64,
                        "block_k": 64,
                        "num_warps": 8,
                        "num_ctas": 1,
                        "num_stages": 2,
                        "split_k": 16
                    },
                    "16": {
                        "block_m": 16,
                        "block_n": 32,
                        "block_k": 32,
                        "num_warps": 4,
                        "num_ctas": 1,
                        "num_stages": 4,
                        "split_k": 16
                    },
                    "128": {
                        "block_m": 16,
                        "block_n": 64,
                        "block_k": 32,
                        "num_warps": 4,
                        "num_ctas": 1,
                        "num_stages": 4,
                        "split_k": 8
                    }
                },
                "6400": {
                    "32": {
                        "block_m": 16,
                        "block_n": 32,
                        "block_k": 32,
                        "num_warps": 4,
                        "num_ctas": 1,
                        "num_stages": 5,
                        "split_k": 16
                    },
                    "64": {
                        "block_m": 16,
                        "block_n": 64,
                        "block_k": 32,
                        "num_warps": 4,
                        "num_ctas": 1,
                        "num_stages": 4,
                        "split_k": 16
                    },
                    "16": {
                        "block_m": 16,
                        "block_n": 32,
                        "block_k": 32,
                        "num_warps": 4,
                        "num_ctas": 1,
                        "num_stages": 5,
                        "split_k": 16
                    }
                },
                "1024": {
                    "64": {
                        "block_m": 16,
                        "block_n": 32,
                        "block_k": 32,
                        "num_warps": 4,
                        "num_ctas": 1,
                        "num_stages": 2,
                        "split_k": 16
                    }
                },
                "3200": {
                    "64": {
                        "block_m": 16,
                        "block_n": 64,
                        "block_k": 32,
                        "num_warps": 4,
                        "num_ctas": 1,
                        "num_stages": 4,
                        "split_k": 16
                    }
                }
            },
            "32": {
                "2048": {
                    "32": {
                        "block_m": 32,
                        "block_n": 32,
                        "block_k": 32,
                        "num_warps": 4,
                        "num_ctas": 1,
                        "num_stages": 4,
                        "split_k": 16
                    },
                    "64": {
                        "block_m": 16,
                        "block_n": 64,
                        "block_k": 64,
                        "num_warps": 4,
                        "num_ctas": 1,
                        "num_stages": 2,
                        "split_k": 16
                    },
                    "16": {
                        "block_m": 16,
                        "block_n": 32,
                        "block_k": 64,
                        "num_warps": 4,
                        "num_ctas": 1,
                        "num_stages": 3,
                        "split_k": 8
                    },
                    "128": {
                        "block_m": 16,
                        "block_n": 64,
                        "block_k": 64,
                        "num_warps": 4,
                        "num_ctas": 1,
                        "num_stages": 3,
                        "split_k": 4
                    }
                },
                "6400": {
                    "32": {
                        "block_m": 32,
                        "block_n": 32,
                        "block_k": 32,
                        "num_warps": 4,
                        "num_ctas": 1,
                        "num_stages": 4,
                        "split_k": 16
                    },
                    "64": {
                        "block_m": 16,
                        "block_n": 64,
                        "block_k": 64,
                        "num_warps": 4,
                        "num_ctas": 1,
                        "num_stages": 3,
                        "split_k": 8
                    },
                    "16": {
                        "block_m": 32,
                        "block_n": 32,
                        "block_k": 32,
                        "num_warps": 4,
                        "num_ctas": 1,
                        "num_stages": 4,
                        "split_k": 16
                    }
                },
                "1024": {
                    "64": {
                        "block_m": 16,
                        "block_n": 32,
                        "block_k": 64,
                        "num_warps": 4,
                        "num_ctas": 1,
                        "num_stages": 3,
                        "split_k": 4
                    }
                },
                "3200": {
                    "64": {
                        "block_m": 32,
                        "block_n": 64,
                        "block_k": 32,
                        "num_warps": 4,
                        "num_ctas": 1,
                        "num_stages": 4,
                        "split_k": 16
                    }
                }
            },
            "64": {
                "2048": {
                    "32": {
                        "block_m": 16,
                        "block_n": 32,
                        "block_k": 64,
                        "num_warps": 4,
                        "num_ctas": 1,
                        "num_stages": 2,
                        "split_k": 16
                    },
                    "64": {
                        "block_m": 16,
                        "block_n": 64,
                        "block_k": 256,
                        "num_warps": 4,
                        "num_ctas": 1,
                        "num_stages": 2,
                        "split_k": 4
                    },
                    "16": {
                        "block_m": 32,
                        "block_n": 32,
                        "block_k": 64,
                        "num_warps": 4,
                        "num_ctas": 1,
                        "num_stages": 2,
                        "split_k": 16
                    },
                    "128": {
                        "block_m": 16,
                        "block_n": 128,
                        "block_k": 128,
                        "num_warps": 4,
                        "num_ctas": 1,
                        "num_stages": 3,
                        "split_k": 4
                    }
                },
                "6400": {
                    "32": {
                        "block_m": 16,
                        "block_n": 32,
                        "block_k": 64,
                        "num_warps": 4,
                        "num_ctas": 1,
                        "num_stages": 3,
                        "split_k": 16
                    },
                    "64": {
                        "block_m": 16,
                        "block_n": 64,
                        "block_k": 256,
                        "num_warps": 4,
                        "num_ctas": 1,
                        "num_stages": 3,
                        "split_k": 4
                    },
                    "16": {
                        "block_m": 16,
                        "block_n": 32,
                        "block_k": 64,
                        "num_warps": 4,
                        "num_ctas": 1,
                        "num_stages": 3,
                        "split_k": 16
                    }
                },
                "1024": {
                    "64": {
                        "block_m": 16,
                        "block_n": 64,
                        "block_k": 64,
                        "num_warps": 4,
                        "num_ctas": 1,
                        "num_stages": 4,
                        "split_k": 4
                    }
                },
                "3200": {
                    "64": {
                        "block_m": 64,
                        "block_n": 64,
                        "block_k": 32,
                        "num_warps": 4,
                        "num_ctas": 1,
                        "num_stages": 5,
                        "split_k": 8
                    }
                }
            },
            "128": {
                "2048": {
                    "32": {
                        "block_m": 16,
                        "block_n": 32,
                        "block_k": 64,
                        "num_warps": 4,
                        "num_ctas": 1,
                        "num_stages": 3,
                        "split_k": 8
                    },
                    "64": {
                        "block_m": 16,
                        "block_n": 64,
                        "block_k": 64,
                        "num_warps": 4,
                        "num_ctas": 1,
                        "num_stages": 3,
                        "split_k": 8
                    },
                    "16": {
                        "block_m": 16,
                        "block_n": 32,
                        "block_k": 64,
                        "num_warps": 4,
                        "num_ctas": 1,
                        "num_stages": 3,
                        "split_k": 8
                    },
                    "128": {
                        "block_m": 64,
                        "block_n": 64,
                        "block_k": 128,
                        "num_warps": 4,
                        "num_ctas": 1,
                        "num_stages": 3,
                        "split_k": 4
                    }
                },
                "6400": {
                    "32": {
                        "block_m": 16,
                        "block_n": 32,
                        "block_k": 64,
                        "num_warps": 4,
                        "num_ctas": 1,
                        "num_stages": 3,
                        "split_k": 8
                    },
                    "64": {
                        "block_m": 64,
                        "block_n": 64,
                        "block_k": 128,
                        "num_warps": 4,
                        "num_ctas": 1,
                        "num_stages": 4,
                        "split_k": 4
                    },
                    "16": {
                        "block_m": 16,
                        "block_n": 32,
                        "block_k": 64,
                        "num_warps": 4,
                        "num_ctas": 1,
                        "num_stages": 3,
                        "split_k": 8
                    }
                },
                "1024": {
                    "64": {
                        "block_m": 16,
                        "block_n": 64,
                        "block_k": 64,
                        "num_warps": 4,
                        "num_ctas": 1,
                        "num_stages": 2,
                        "split_k": 8
                    }
                },
                "3200": {
                    "64": {
                        "block_m": 16,
                        "block_n": 64,
                        "block_k": 64,
                        "num_warps": 4,
                        "num_ctas": 1,
                        "num_stages": 3,
                        "split_k": 8
                    }
                }
            },
            "256": {
                "2048": {
                    "32": {
                        "block_m": 64,
                        "block_n": 32,
                        "block_k": 64,
                        "num_warps": 4,
                        "num_ctas": 1,
                        "num_stages": 3,
                        "split_k": 4
                    },
                    "64": {
                        "block_m": 64,
                        "block_n": 64,
                        "block_k": 64,
                        "num_warps": 8,
                        "num_ctas": 1,
                        "num_stages": 3,
                        "split_k": 4
                    },
                    "16": {
                        "block_m": 64,
                        "block_n": 32,
                        "block_k": 128,
                        "num_warps": 4,
                        "num_ctas": 1,
                        "num_stages": 4,
                        "split_k": 4
                    },
                    "128": {
                        "block_m": 64,
                        "block_n": 128,
                        "block_k": 64,
                        "num_warps": 8,
                        "num_ctas": 1,
                        "num_stages": 4,
                        "split_k": 4
                    }
                },
                "6400": {
                    "32": {
                        "block_m": 64,
                        "block_n": 32,
                        "block_k": 128,
                        "num_warps": 4,
                        "num_ctas": 1,
                        "num_stages": 4,
                        "split_k": 4
                    },
                    "64": {
                        "block_m": 64,
                        "block_n": 64,
                        "block_k": 128,
                        "num_warps": 4,
                        "num_ctas": 1,
                        "num_stages": 3,
                        "split_k": 4
                    },
                    "16": {
                        "block_m": 64,
                        "block_n": 32,
                        "block_k": 128,
                        "num_warps": 4,
                        "num_ctas": 1,
                        "num_stages": 4,
                        "split_k": 4
                    }
                },
                "1024": {
                    "64": {
                        "block_m": 64,
                        "block_n": 64,
                        "block_k": 64,
                        "num_warps": 8,
                        "num_ctas": 1,
                        "num_stages": 3,
                        "split_k": 4
                    }
                },
                "3200": {
                    "64": {
                        "block_m": 64,
                        "block_n": 64,
                        "block_k": 64,
                        "num_warps": 8,
                        "num_ctas": 1,
                        "num_stages": 3,
                        "split_k": 4
                    }
                }
            },
            "512": {
                "2048": {
                    "32": {
                        "block_m": 128,
                        "block_n": 32,
                        "block_k": 64,
                        "num_warps": 8,
                        "num_ctas": 1,
                        "num_stages": 4,
                        "split_k": 4
                    },
                    "64": {
                        "block_m": 128,
                        "block_n": 64,
                        "block_k": 32,
                        "num_warps": 8,
                        "num_ctas": 1,
                        "num_stages": 5,
                        "split_k": 4
                    },
                    "16": {
                        "block_m": 128,
                        "block_n": 32,
                        "block_k": 64,
                        "num_warps": 8,
                        "num_ctas": 1,
                        "num_stages": 3,
                        "split_k": 4
                    },
                    "128": {
                        "block_m": 64,
                        "block_n": 32,
                        "block_k": 64,
                        "num_warps": 4,
                        "num_ctas": 1,
                        "num_stages": 4,
                        "split_k": 4
                    }
                },
                "6400": {
                    "32": {
                        "block_m": 64,
                        "block_n": 32,
                        "block_k": 32,
                        "num_warps": 4,
                        "num_ctas": 1,
                        "num_stages": 4,
                        "split_k": 8
                    },
                    "64": {
                        "block_m": 64,
                        "block_n": 64,
                        "block_k": 128,
                        "num_warps": 4,
                        "num_ctas": 1,
                        "num_stages": 4,
                        "split_k": 4
                    },
                    "16": {
                        "block_m": 64,
                        "block_n": 32,
                        "block_k": 128,
                        "num_warps": 4,
                        "num_ctas": 1,
                        "num_stages": 5,
                        "split_k": 4
                    }
                },
                "1024": {
                    "64": {
                        "block_m": 128,
                        "block_n": 64,
                        "block_k": 64,
                        "num_warps": 8,
                        "num_ctas": 1,
                        "num_stages": 3,
                        "split_k": 4
                    }
                },
                "3200": {
                    "64": {
                        "block_m": 128,
                        "block_n": 64,
                        "block_k": 32,
                        "num_warps": 8,
                        "num_ctas": 1,
                        "num_stages": 4,
                        "split_k": 4
                    }
                }
            },
            "1024": {
                "2048": {
                    "32": {
                        "block_m": 64,
                        "block_n": 32,
                        "block_k": 32,
                        "num_warps": 4,
                        "num_ctas": 1,
                        "num_stages": 4,
                        "split_k": 4
                    },
                    "64": {
                        "block_m": 64,
                        "block_n": 32,
                        "block_k": 64,
                        "num_warps": 4,
                        "num_ctas": 1,
                        "num_stages": 5,
                        "split_k": 4
                    },
                    "16": {
                        "block_m": 64,
                        "block_n": 32,
                        "block_k": 32,
                        "num_warps": 4,
                        "num_ctas": 1,
                        "num_stages": 4,
                        "split_k": 4
                    },
                    "128": {
                        "block_m": 64,
                        "block_n": 32,
                        "block_k": 64,
                        "num_warps": 4,
                        "num_ctas": 1,
                        "num_stages": 3,
                        "split_k": 4
                    }
                },
                "6400": {
                    "32": {
                        "block_m": 64,
                        "block_n": 32,
                        "block_k": 64,
                        "num_warps": 4,
                        "num_ctas": 1,
                        "num_stages": 3,
                        "split_k": 16
                    },
                    "64": {
                        "block_m": 64,
                        "block_n": 64,
                        "block_k": 128,
                        "num_warps": 8,
                        "num_ctas": 1,
                        "num_stages": 4,
                        "split_k": 4
                    },
                    "16": {
                        "block_m": 64,
                        "block_n": 32,
                        "block_k": 64,
                        "num_warps": 4,
                        "num_ctas": 1,
                        "num_stages": 3,
                        "split_k": 16
                    }
                },
                "1024": {
                    "64": {
                        "block_m": 32,
                        "block_n": 32,
                        "block_k": 128,
                        "num_warps": 4,
                        "num_ctas": 1,
                        "num_stages": 2,
                        "split_k": 4
                    }
                },
                "3200": {
                    "64": {
                        "block_m": 64,
                        "block_n": 32,
                        "block_k": 64,
                        "num_warps": 4,
                        "num_ctas": 1,
                        "num_stages": 3,
                        "split_k": 8
                    }
                }
            },
            "1536": {
                "2048": {
                    "32": {
                        "block_m": 64,
                        "block_n": 32,
                        "block_k": 64,
                        "num_warps": 4,
                        "num_ctas": 1,
                        "num_stages": 3,
                        "split_k": 8
                    },
                    "64": {
                        "block_m": 64,
                        "block_n": 32,
                        "block_k": 64,
                        "num_warps": 4,
                        "num_ctas": 1,
                        "num_stages": 4,
                        "split_k": 4
                    },
                    "16": {
                        "block_m": 64,
                        "block_n": 32,
                        "block_k": 64,
                        "num_warps": 4,
                        "num_ctas": 1,
                        "num_stages": 3,
                        "split_k": 8
                    },
                    "128": {
                        "block_m": 64,
                        "block_n": 32,
                        "block_k": 64,
                        "num_warps": 4,
                        "num_ctas": 1,
                        "num_stages": 3,
                        "split_k": 4
                    }
                },
                "6400": {
                    "32": {
                        "block_m": 128,
                        "block_n": 32,
                        "block_k": 128,
                        "num_warps": 8,
                        "num_ctas": 1,
                        "num_stages": 3,
                        "split_k": 4
                    },
                    "64": {
                        "block_m": 128,
                        "block_n": 64,
                        "block_k": 64,
                        "num_warps": 8,
                        "num_ctas": 1,
                        "num_stages": 5,
                        "split_k": 4
                    },
                    "16": {
                        "block_m": 64,
                        "block_n": 32,
                        "block_k": 64,
                        "num_warps": 4,
                        "num_ctas": 1,
                        "num_stages": 4,
                        "split_k": 8
                    }
                },
                "1024": {
                    "64": {
                        "block_m": 64,
                        "block_n": 32,
                        "block_k": 64,
                        "num_warps": 4,
                        "num_ctas": 1,
                        "num_stages": 3,
                        "split_k": 4
                    }
                },
                "3200": {
                    "64": {
                        "block_m": 64,
                        "block_n": 32,
                        "block_k": 64,
                        "num_warps": 4,
                        "num_ctas": 1,
                        "num_stages": 4,
                        "split_k": 4
                    }
                }
            },
            "2048": {
                "2048": {
                    "32": {
                        "block_m": 64,
                        "block_n": 32,
                        "block_k": 64,
                        "num_warps": 4,
                        "num_ctas": 1,
                        "num_stages": 3,
                        "split_k": 8
                    },
                    "64": {
                        "block_m": 64,
                        "block_n": 32,
                        "block_k": 64,
                        "num_warps": 4,
                        "num_ctas": 1,
                        "num_stages": 3,
                        "split_k": 4
                    },
                    "16": {
                        "block_m": 64,
                        "block_n": 32,
                        "block_k": 64,
                        "num_warps": 4,
                        "num_ctas": 1,
                        "num_stages": 3,
                        "split_k": 8
                    },
                    "128": {
                        "block_m": 64,
                        "block_n": 64,
                        "block_k": 64,
                        "num_warps": 8,
                        "num_ctas": 1,
                        "num_stages": 3,
                        "split_k": 4
                    }
                },
                "6400": {
                    "32": {
                        "block_m": 64,
                        "block_n": 32,
                        "block_k": 64,
                        "num_warps": 4,
                        "num_ctas": 1,
                        "num_stages": 4,
                        "split_k": 8
                    },
                    "64": {
                        "block_m": 128,
                        "block_n": 64,
                        "block_k": 64,
                        "num_warps": 8,
                        "num_ctas": 1,
                        "num_stages": 5,
                        "split_k": 4
                    },
                    "16": {
                        "block_m": 64,
                        "block_n": 32,
                        "block_k": 64,
                        "num_warps": 4,
                        "num_ctas": 1,
                        "num_stages": 3,
                        "split_k": 8
                    }
                },
                "1024": {
                    "64": {
                        "block_m": 64,
                        "block_n": 32,
                        "block_k": 64,
                        "num_warps": 4,
                        "num_ctas": 1,
                        "num_stages": 3,
                        "split_k": 4
                    }
                },
                "3200": {
                    "64": {
                        "block_m": 64,
                        "block_n": 32,
                        "block_k": 64,
                        "num_warps": 4,
                        "num_ctas": 1,
                        "num_stages": 4,
                        "split_k": 4
                    }
                }
            },
            "4096": {
                "2048": {
                    "32": {
                        "block_m": 64,
                        "block_n": 32,
                        "block_k": 64,
                        "num_warps": 4,
                        "num_ctas": 1,
                        "num_stages": 3,
                        "split_k": 4
                    },
                    "64": {
                        "block_m": 64,
                        "block_n": 64,
                        "block_k": 64,
                        "num_warps": 8,
                        "num_ctas": 1,
                        "num_stages": 3,
                        "split_k": 4
                    },
                    "16": {
                        "block_m": 64,
                        "block_n": 32,
                        "block_k": 64,
                        "num_warps": 4,
                        "num_ctas": 1,
                        "num_stages": 3,
                        "split_k": 4
                    },
                    "128": {
                        "block_m": 128,
                        "block_n": 64,
                        "block_k": 64,
                        "num_warps": 8,
                        "num_ctas": 1,
                        "num_stages": 3,
                        "split_k": 4
                    }
                },
                "6400": {
                    "32": {
                        "block_m": 64,
                        "block_n": 32,
                        "block_k": 64,
                        "num_warps": 4,
                        "num_ctas": 1,
                        "num_stages": 4,
                        "split_k": 4
                    },
                    "64": {
                        "block_m": 64,
                        "block_n": 64,
                        "block_k": 64,
                        "num_warps": 8,
                        "num_ctas": 1,
                        "num_stages": 4,
                        "split_k": 4
                    },
                    "16": {
                        "block_m": 64,
                        "block_n": 32,
                        "block_k": 64,
                        "num_warps": 4,
                        "num_ctas": 1,
                        "num_stages": 5,
                        "split_k": 4
                    }
                },
                "1024": {
                    "64": {
                        "block_m": 64,
                        "block_n": 32,
                        "block_k": 64,
                        "num_warps": 4,
                        "num_ctas": 1,
                        "num_stages": 2,
                        "split_k": 4
                    }
                },
                "3200": {
                    "64": {
                        "block_m": 64,
                        "block_n": 64,
                        "block_k": 64,
                        "num_warps": 4,
                        "num_ctas": 1,
                        "num_stages": 4,
                        "split_k": 4
                    }
                }
            },
            "5120": {
                "2048": {
                    "32": {
                        "block_m": 64,
                        "block_n": 32,
                        "block_k": 64,
                        "num_warps": 4,
                        "num_ctas": 1,
                        "num_stages": 3,
                        "split_k": 4
                    },
                    "64": {
                        "block_m": 64,
                        "block_n": 64,
                        "block_k": 64,
                        "num_warps": 8,
                        "num_ctas": 1,
                        "num_stages": 2,
                        "split_k": 4
                    },
                    "16": {
                        "block_m": 64,
                        "block_n": 32,
                        "block_k": 64,
                        "num_warps": 4,
                        "num_ctas": 1,
                        "num_stages": 3,
                        "split_k": 4
                    },
                    "128": {
                        "block_m": 64,
                        "block_n": 128,
                        "block_k": 32,
                        "num_warps": 8,
                        "num_ctas": 1,
                        "num_stages": 3,
                        "split_k": 4
                    }
                },
                "6400": {
                    "32": {
                        "block_m": 64,
                        "block_n": 32,
                        "block_k": 64,
                        "num_warps": 4,
                        "num_ctas": 1,
                        "num_stages": 4,
                        "split_k": 4
                    },
                    "64": {
                        "block_m": 64,
                        "block_n": 64,
                        "block_k": 64,
                        "num_warps": 8,
                        "num_ctas": 1,
                        "num_stages": 4,
                        "split_k": 4
                    },
                    "16": {
                        "block_m": 64,
                        "block_n": 32,
                        "block_k": 64,
                        "num_warps": 4,
                        "num_ctas": 1,
                        "num_stages": 4,
                        "split_k": 4
                    }
                },
                "1024": {
                    "64": {
                        "block_m": 64,
                        "block_n": 64,
                        "block_k": 32,
                        "num_warps": 8,
                        "num_ctas": 1,
                        "num_stages": 3,
                        "split_k": 4
                    }
                },
                "3200": {
                    "64": {
                        "block_m": 64,
                        "block_n": 64,
                        "block_k": 64,
                        "num_warps": 4,
                        "num_ctas": 1,
                        "num_stages": 3,
                        "split_k": 4
                    }
                }
            },
            "6144": {
                "2048": {
                    "32": {
                        "block_m": 64,
                        "block_n": 32,
                        "block_k": 64,
                        "num_warps": 4,
                        "num_ctas": 1,
                        "num_stages": 3,
                        "split_k": 4
                    },
                    "64": {
                        "block_m": 64,
                        "block_n": 64,
                        "block_k": 32,
                        "num_warps": 8,
                        "num_ctas": 1,
                        "num_stages": 3,
                        "split_k": 4
                    },
                    "16": {
                        "block_m": 64,
                        "block_n": 32,
                        "block_k": 64,
                        "num_warps": 4,
                        "num_ctas": 1,
                        "num_stages": 3,
                        "split_k": 4
                    },
                    "128": {
                        "block_m": 128,
                        "block_n": 64,
                        "block_k": 32,
                        "num_warps": 8,
                        "num_ctas": 1,
                        "num_stages": 3,
                        "split_k": 4
                    }
                },
                "6400": {
                    "32": {
                        "block_m": 64,
                        "block_n": 32,
                        "block_k": 64,
                        "num_warps": 4,
                        "num_ctas": 1,
                        "num_stages": 3,
                        "split_k": 4
                    },
                    "64": {
                        "block_m": 64,
                        "block_n": 64,
                        "block_k": 64,
                        "num_warps": 8,
                        "num_ctas": 1,
                        "num_stages": 3,
                        "split_k": 4
                    },
                    "16": {
                        "block_m": 64,
                        "block_n": 32,
                        "block_k": 64,
                        "num_warps": 4,
                        "num_ctas": 1,
                        "num_stages": 4,
                        "split_k": 4
                    }
                },
                "1024": {
                    "64": {
                        "block_m": 64,
                        "block_n": 64,
                        "block_k": 64,
                        "num_warps": 4,
                        "num_ctas": 1,
                        "num_stages": 2,
                        "split_k": 4
                    }
                },
                "3200": {
                    "64": {
                        "block_m": 128,
                        "block_n": 64,
                        "block_k": 64,
                        "num_warps": 8,
                        "num_ctas": 1,
                        "num_stages": 4,
                        "split_k": 4
                    }
                }
            },
            "7168": {
                "2048": {
                    "32": {
                        "block_m": 64,
                        "block_n": 32,
                        "block_k": 64,
                        "num_warps": 4,
                        "num_ctas": 1,
                        "num_stages": 3,
                        "split_k": 4
                    },
                    "64": {
                        "block_m": 128,
                        "block_n": 64,
                        "block_k": 64,
                        "num_warps": 8,
                        "num_ctas": 1,
                        "num_stages": 3,
                        "split_k": 4
                    },
                    "16": {
                        "block_m": 64,
                        "block_n": 32,
                        "block_k": 64,
                        "num_warps": 4,
                        "num_ctas": 1,
                        "num_stages": 3,
                        "split_k": 4
                    },
                    "128": {
                        "block_m": 64,
                        "block_n": 128,
                        "block_k": 32,
                        "num_warps": 8,
                        "num_ctas": 1,
                        "num_stages": 3,
                        "split_k": 4
                    }
                },
                "6400": {
                    "32": {
                        "block_m": 64,
                        "block_n": 32,
                        "block_k": 64,
                        "num_warps": 4,
                        "num_ctas": 1,
                        "num_stages": 3,
                        "split_k": 4
                    },
                    "64": {
                        "block_m": 64,
                        "block_n": 64,
                        "block_k": 64,
                        "num_warps": 4,
                        "num_ctas": 1,
                        "num_stages": 3,
                        "split_k": 4
                    },
                    "16": {
                        "block_m": 64,
                        "block_n": 32,
                        "block_k": 64,
                        "num_warps": 4,
                        "num_ctas": 1,
                        "num_stages": 4,
                        "split_k": 4
                    }
                },
                "1024": {
                    "64": {
                        "block_m": 64,
                        "block_n": 64,
                        "block_k": 32,
                        "num_warps": 4,
                        "num_ctas": 1,
                        "num_stages": 3,
                        "split_k": 4
                    }
                },
                "3200": {
                    "64": {
                        "block_m": 64,
                        "block_n": 64,
                        "block_k": 64,
                        "num_warps": 4,
                        "num_ctas": 1,
                        "num_stages": 3,
                        "split_k": 4
                    }
                }
            },
            "8192": {
                "2048": {
                    "32": {
                        "block_m": 64,
                        "block_n": 32,
                        "block_k": 32,
                        "num_warps": 4,
                        "num_ctas": 1,
                        "num_stages": 4,
                        "split_k": 4
                    },
                    "64": {
                        "block_m": 128,
                        "block_n": 64,
                        "block_k": 64,
                        "num_warps": 8,
                        "num_ctas": 1,
                        "num_stages": 3,
                        "split_k": 4
                    },
                    "16": {
                        "block_m": 64,
                        "block_n": 32,
                        "block_k": 64,
                        "num_warps": 4,
                        "num_ctas": 1,
                        "num_stages": 2,
                        "split_k": 4
                    },
                    "128": {
                        "block_m": 128,
                        "block_n": 64,
                        "block_k": 32,
                        "num_warps": 8,
                        "num_ctas": 1,
                        "num_stages": 4,
                        "split_k": 4
                    }
                },
                "6400": {
                    "32": {
                        "block_m": 64,
                        "block_n": 32,
                        "block_k": 64,
                        "num_warps": 4,
                        "num_ctas": 1,
                        "num_stages": 3,
                        "split_k": 4
                    },
                    "64": {
                        "block_m": 128,
                        "block_n": 64,
                        "block_k": 64,
                        "num_warps": 8,
                        "num_ctas": 1,
                        "num_stages": 3,
                        "split_k": 4
                    },
                    "16": {
                        "block_m": 64,
                        "block_n": 32,
                        "block_k": 64,
                        "num_warps": 4,
                        "num_ctas": 1,
                        "num_stages": 3,
                        "split_k": 4
                    }
                },
                "1024": {
                    "64": {
                        "block_m": 128,
                        "block_n": 64,
                        "block_k": 32,
                        "num_warps": 8,
                        "num_ctas": 1,
                        "num_stages": 3,
                        "split_k": 4
                    }
                },
                "3200": {
                    "64": {
                        "block_m": 128,
                        "block_n": 64,
                        "block_k": 64,
                        "num_warps": 8,
                        "num_ctas": 1,
                        "num_stages": 3,
                        "split_k": 4
                    }
                }
            },
            "10240": {
                "2048": {
                    "32": {
                        "block_m": 64,
                        "block_n": 32,
                        "block_k": 64,
                        "num_warps": 4,
                        "num_ctas": 1,
                        "num_stages": 2,
                        "split_k": 4
                    },
                    "64": {
                        "block_m": 128,
                        "block_n": 64,
                        "block_k": 64,
                        "num_warps": 8,
                        "num_ctas": 1,
                        "num_stages": 3,
                        "split_k": 4
                    },
                    "16": {
                        "block_m": 64,
                        "block_n": 32,
                        "block_k": 64,
                        "num_warps": 4,
                        "num_ctas": 1,
                        "num_stages": 2,
                        "split_k": 4
                    },
                    "128": {
                        "block_m": 128,
                        "block_n": 64,
                        "block_k": 32,
                        "num_warps": 8,
                        "num_ctas": 1,
                        "num_stages": 4,
                        "split_k": 4
                    }
                },
                "6400": {
                    "32": {
                        "block_m": 64,
                        "block_n": 32,
                        "block_k": 64,
                        "num_warps": 4,
                        "num_ctas": 1,
                        "num_stages": 3,
                        "split_k": 4
                    },
                    "64": {
                        "block_m": 128,
                        "block_n": 64,
                        "block_k": 64,
                        "num_warps": 8,
                        "num_ctas": 1,
                        "num_stages": 3,
                        "split_k": 4
                    },
                    "16": {
                        "block_m": 64,
                        "block_n": 32,
                        "block_k": 64,
                        "num_warps": 4,
                        "num_ctas": 1,
                        "num_stages": 3,
                        "split_k": 4
                    }
                },
                "1024": {
                    "64": {
                        "block_m": 128,
                        "block_n": 64,
                        "block_k": 32,
                        "num_warps": 8,
                        "num_ctas": 1,
                        "num_stages": 3,
                        "split_k": 4
                    }
                },
                "3200": {
                    "64": {
                        "block_m": 128,
                        "block_n": 64,
                        "block_k": 64,
                        "num_warps": 8,
                        "num_ctas": 1,
                        "num_stages": 3,
                        "split_k": 4
                    }
                }
            }
        },
        "2": {
            "1": {
                "5120": {
                    "32": {
                        "block_m": 16,
                        "block_n": 32,
                        "block_k": 32,
                        "num_warps": 4,
                        "num_ctas": 1,
                        "num_stages": 3,
                        "split_k": 64
                    },
                    "64": {
                        "block_m": 16,
                        "block_n": 32,
                        "block_k": 32,
                        "num_warps": 4,
                        "num_ctas": 1,
                        "num_stages": 4,
                        "split_k": 64
                    },
                    "16": {
                        "block_m": 16,
                        "block_n": 32,
                        "block_k": 32,
                        "num_warps": 4,
                        "num_ctas": 1,
                        "num_stages": 3,
                        "split_k": 64
                    },
                    "128": {
                        "block_m": 16,
                        "block_n": 32,
                        "block_k": 32,
                        "num_warps": 4,
                        "num_ctas": 1,
                        "num_stages": 3,
                        "split_k": 32
                    }
                }
            },
            "2": {
                "5120": {
                    "32": {
                        "block_m": 16,
                        "block_n": 32,
                        "block_k": 32,
                        "num_warps": 4,
                        "num_ctas": 1,
                        "num_stages": 4,
                        "split_k": 64
                    },
                    "64": {
                        "block_m": 16,
                        "block_n": 32,
                        "block_k": 32,
                        "num_warps": 4,
                        "num_ctas": 1,
                        "num_stages": 3,
                        "split_k": 32
                    },
                    "16": {
                        "block_m": 16,
                        "block_n": 32,
                        "block_k": 32,
                        "num_warps": 4,
                        "num_ctas": 1,
                        "num_stages": 4,
                        "split_k": 64
                    },
                    "128": {
                        "block_m": 16,
                        "block_n": 32,
                        "block_k": 64,
                        "num_warps": 4,
                        "num_ctas": 1,
                        "num_stages": 5,
                        "split_k": 16
                    }
                }
            },
            "4": {
                "5120": {
                    "32": {
                        "block_m": 16,
                        "block_n": 32,
                        "block_k": 64,
                        "num_warps": 4,
                        "num_ctas": 1,
                        "num_stages": 2,
                        "split_k": 32
                    },
                    "64": {
                        "block_m": 16,
                        "block_n": 32,
                        "block_k": 64,
                        "num_warps": 4,
                        "num_ctas": 1,
                        "num_stages": 5,
                        "split_k": 16
                    },
                    "16": {
                        "block_m": 16,
                        "block_n": 32,
                        "block_k": 32,
                        "num_warps": 4,
                        "num_ctas": 1,
                        "num_stages": 3,
                        "split_k": 32
                    },
                    "128": {
                        "block_m": 16,
                        "block_n": 128,
                        "block_k": 32,
                        "num_warps": 8,
                        "num_ctas": 1,
                        "num_stages": 3,
                        "split_k": 32
                    }
                }
            },
            "8": {
                "5120": {
                    "32": {
                        "block_m": 16,
                        "block_n": 32,
                        "block_k": 128,
                        "num_warps": 4,
                        "num_ctas": 1,
                        "num_stages": 3,
                        "split_k": 16
                    },
                    "64": {
                        "block_m": 16,
                        "block_n": 64,
                        "block_k": 64,
                        "num_warps": 8,
                        "num_ctas": 1,
                        "num_stages": 5,
                        "split_k": 16
                    },
                    "16": {
                        "block_m": 16,
                        "block_n": 32,
                        "block_k": 64,
                        "num_warps": 4,
                        "num_ctas": 1,
                        "num_stages": 5,
                        "split_k": 16
                    },
                    "128": {
                        "block_m": 16,
                        "block_n": 128,
                        "block_k": 32,
                        "num_warps": 8,
                        "num_ctas": 1,
                        "num_stages": 3,
                        "split_k": 16
                    }
                }
            },
            "16": {
                "5120": {
                    "32": {
                        "block_m": 16,
                        "block_n": 32,
                        "block_k": 64,
                        "num_warps": 4,
                        "num_ctas": 1,
                        "num_stages": 5,
                        "split_k": 16
                    },
                    "64": {
                        "block_m": 16,
                        "block_n": 64,
                        "block_k": 64,
                        "num_warps": 4,
                        "num_ctas": 1,
                        "num_stages": 5,
                        "split_k": 16
                    },
                    "16": {
                        "block_m": 16,
                        "block_n": 32,
                        "block_k": 64,
                        "num_warps": 4,
                        "num_ctas": 1,
                        "num_stages": 3,
                        "split_k": 16
                    },
                    "128": {
                        "block_m": 16,
                        "block_n": 64,
                        "block_k": 128,
                        "num_warps": 4,
                        "num_ctas": 1,
                        "num_stages": 4,
                        "split_k": 4
                    }
                }
            },
            "32": {
                "5120": {
                    "32": {
                        "block_m": 16,
                        "block_n": 32,
                        "block_k": 256,
                        "num_warps": 4,
                        "num_ctas": 1,
                        "num_stages": 5,
                        "split_k": 4
                    },
                    "64": {
                        "block_m": 16,
                        "block_n": 64,
                        "block_k": 64,
                        "num_warps": 4,
                        "num_ctas": 1,
                        "num_stages": 3,
                        "split_k": 16
                    },
                    "16": {
                        "block_m": 16,
                        "block_n": 32,
                        "block_k": 256,
                        "num_warps": 4,
                        "num_ctas": 1,
                        "num_stages": 5,
                        "split_k": 4
                    },
                    "128": {
                        "block_m": 16,
                        "block_n": 64,
                        "block_k": 128,
                        "num_warps": 4,
                        "num_ctas": 1,
                        "num_stages": 5,
                        "split_k": 4
                    }
                }
            },
            "64": {
                "5120": {
                    "32": {
                        "block_m": 32,
                        "block_n": 32,
                        "block_k": 64,
                        "num_warps": 4,
                        "num_ctas": 1,
                        "num_stages": 2,
                        "split_k": 16
                    },
                    "64": {
                        "block_m": 64,
                        "block_n": 64,
                        "block_k": 128,
                        "num_warps": 4,
                        "num_ctas": 1,
                        "num_stages": 3,
                        "split_k": 8
                    },
                    "16": {
                        "block_m": 32,
                        "block_n": 32,
                        "block_k": 64,
                        "num_warps": 4,
                        "num_ctas": 1,
                        "num_stages": 2,
                        "split_k": 16
                    },
                    "128": {
                        "block_m": 64,
                        "block_n": 64,
                        "block_k": 32,
                        "num_warps": 4,
                        "num_ctas": 1,
                        "num_stages": 3,
                        "split_k": 8
                    }
                }
            },
            "128": {
                "5120": {
                    "32": {
                        "block_m": 32,
                        "block_n": 32,
                        "block_k": 64,
                        "num_warps": 4,
                        "num_ctas": 1,
                        "num_stages": 2,
                        "split_k": 16
                    },
                    "64": {
                        "block_m": 64,
                        "block_n": 64,
                        "block_k": 128,
                        "num_warps": 4,
                        "num_ctas": 1,
                        "num_stages": 3,
                        "split_k": 8
                    },
                    "16": {
                        "block_m": 16,
                        "block_n": 32,
                        "block_k": 64,
                        "num_warps": 4,
                        "num_ctas": 1,
                        "num_stages": 3,
                        "split_k": 16
                    },
                    "128": {
                        "block_m": 64,
                        "block_n": 64,
                        "block_k": 32,
                        "num_warps": 4,
                        "num_ctas": 1,
                        "num_stages": 4,
                        "split_k": 8
                    }
                }
            },
            "256": {
                "5120": {
                    "32": {
                        "block_m": 32,
                        "block_n": 32,
                        "block_k": 128,
                        "num_warps": 4,
                        "num_ctas": 1,
                        "num_stages": 3,
                        "split_k": 8
                    },
                    "64": {
                        "block_m": 64,
                        "block_n": 64,
                        "block_k": 128,
                        "num_warps": 4,
                        "num_ctas": 1,
                        "num_stages": 3,
                        "split_k": 8
                    },
                    "16": {
                        "block_m": 32,
                        "block_n": 32,
                        "block_k": 128,
                        "num_warps": 4,
                        "num_ctas": 1,
                        "num_stages": 2,
                        "split_k": 8
                    },
                    "128": {
                        "block_m": 64,
                        "block_n": 64,
                        "block_k": 32,
                        "num_warps": 4,
                        "num_ctas": 1,
                        "num_stages": 5,
                        "split_k": 8
                    }
                }
            },
            "512": {
                "5120": {
                    "32": {
                        "block_m": 64,
                        "block_n": 32,
                        "block_k": 128,
                        "num_warps": 4,
                        "num_ctas": 1,
                        "num_stages": 3,
                        "split_k": 8
                    },
                    "64": {
                        "block_m": 128,
                        "block_n": 64,
                        "block_k": 64,
                        "num_warps": 4,
                        "num_ctas": 1,
                        "num_stages": 3,
                        "split_k": 8
                    },
                    "16": {
                        "block_m": 64,
                        "block_n": 32,
                        "block_k": 64,
                        "num_warps": 4,
                        "num_ctas": 1,
                        "num_stages": 3,
                        "split_k": 16
                    },
                    "128": {
                        "block_m": 128,
                        "block_n": 64,
                        "block_k": 64,
                        "num_warps": 4,
                        "num_ctas": 1,
                        "num_stages": 3,
                        "split_k": 4
                    }
                }
            },
            "1024": {
                "5120": {
                    "32": {
                        "block_m": 64,
                        "block_n": 32,
                        "block_k": 128,
                        "num_warps": 4,
                        "num_ctas": 1,
                        "num_stages": 3,
                        "split_k": 8
                    },
                    "64": {
                        "block_m": 64,
                        "block_n": 64,
                        "block_k": 64,
                        "num_warps": 4,
                        "num_ctas": 1,
                        "num_stages": 3,
                        "split_k": 8
                    },
                    "16": {
                        "block_m": 64,
                        "block_n": 32,
                        "block_k": 256,
                        "num_warps": 4,
                        "num_ctas": 1,
                        "num_stages": 3,
                        "split_k": 4
                    },
                    "128": {
                        "block_m": 128,
                        "block_n": 64,
                        "block_k": 64,
                        "num_warps": 4,
                        "num_ctas": 1,
                        "num_stages": 3,
                        "split_k": 4
                    }
                }
            },
            "1536": {
                "5120": {
                    "32": {
                        "block_m": 128,
                        "block_n": 32,
                        "block_k": 64,
                        "num_warps": 8,
                        "num_ctas": 1,
                        "num_stages": 4,
                        "split_k": 8
                    },
                    "64": {
                        "block_m": 256,
                        "block_n": 64,
                        "block_k": 128,
                        "num_warps": 8,
                        "num_ctas": 1,
                        "num_stages": 3,
                        "split_k": 4
                    },
                    "16": {
                        "block_m": 128,
                        "block_n": 32,
                        "block_k": 64,
                        "num_warps": 8,
                        "num_ctas": 1,
                        "num_stages": 3,
                        "split_k": 8
                    },
                    "128": {
                        "block_m": 128,
                        "block_n": 64,
                        "block_k": 64,
                        "num_warps": 4,
                        "num_ctas": 1,
                        "num_stages": 3,
                        "split_k": 4
                    }
                }
            },
            "2048": {
                "5120": {
                    "32": {
                        "block_m": 128,
                        "block_n": 32,
                        "block_k": 128,
                        "num_warps": 8,
                        "num_ctas": 1,
                        "num_stages": 3,
                        "split_k": 4
                    },
                    "64": {
                        "block_m": 128,
                        "block_n": 32,
                        "block_k": 64,
                        "num_warps": 4,
                        "num_ctas": 1,
                        "num_stages": 4,
                        "split_k": 4
                    },
                    "16": {
                        "block_m": 128,
                        "block_n": 32,
                        "block_k": 64,
                        "num_warps": 8,
                        "num_ctas": 1,
                        "num_stages": 3,
                        "split_k": 8
                    },
                    "128": {
                        "block_m": 128,
                        "block_n": 64,
                        "block_k": 64,
                        "num_warps": 4,
                        "num_ctas": 1,
                        "num_stages": 3,
                        "split_k": 4
                    }
                }
            },
            "4096": {
                "5120": {
                    "32": {
                        "block_m": 128,
                        "block_n": 32,
                        "block_k": 128,
                        "num_warps": 8,
                        "num_ctas": 1,
                        "num_stages": 3,
                        "split_k": 4
                    },
                    "64": {
                        "block_m": 128,
                        "block_n": 32,
                        "block_k": 64,
                        "num_warps": 4,
                        "num_ctas": 1,
                        "num_stages": 3,
                        "split_k": 4
                    },
                    "16": {
                        "block_m": 128,
                        "block_n": 32,
                        "block_k": 64,
                        "num_warps": 8,
                        "num_ctas": 1,
                        "num_stages": 3,
                        "split_k": 4
                    },
                    "128": {
                        "block_m": 256,
                        "block_n": 32,
                        "block_k": 64,
                        "num_warps": 8,
                        "num_ctas": 1,
                        "num_stages": 3,
                        "split_k": 4
                    }
                }
            },
            "5120": {
                "5120": {
                    "32": {
                        "block_m": 256,
                        "block_n": 32,
                        "block_k": 64,
                        "num_warps": 8,
                        "num_ctas": 1,
                        "num_stages": 3,
                        "split_k": 4
                    },
                    "64": {
                        "block_m": 128,
                        "block_n": 64,
                        "block_k": 32,
                        "num_warps": 4,
                        "num_ctas": 1,
                        "num_stages": 5,
                        "split_k": 4
                    },
                    "16": {
                        "block_m": 128,
                        "block_n": 32,
                        "block_k": 64,
                        "num_warps": 8,
                        "num_ctas": 1,
                        "num_stages": 4,
                        "split_k": 4
                    },
                    "128": {
                        "block_m": 128,
                        "block_n": 64,
                        "block_k": 64,
                        "num_warps": 4,
                        "num_ctas": 1,
                        "num_stages": 3,
                        "split_k": 4
                    }
                }
            },
            "6144": {
                "5120": {
                    "32": {
                        "block_m": 256,
                        "block_n": 32,
                        "block_k": 64,
                        "num_warps": 8,
                        "num_ctas": 1,
                        "num_stages": 3,
                        "split_k": 4
                    },
                    "64": {
                        "block_m": 128,
                        "block_n": 64,
                        "block_k": 32,
                        "num_warps": 4,
                        "num_ctas": 1,
                        "num_stages": 5,
                        "split_k": 4
                    },
                    "16": {
                        "block_m": 128,
                        "block_n": 32,
                        "block_k": 64,
                        "num_warps": 8,
                        "num_ctas": 1,
                        "num_stages": 3,
                        "split_k": 4
                    },
                    "128": {
                        "block_m": 128,
                        "block_n": 64,
                        "block_k": 64,
                        "num_warps": 4,
                        "num_ctas": 1,
                        "num_stages": 3,
                        "split_k": 4
                    }
                }
            },
            "7168": {
                "5120": {
                    "32": {
                        "block_m": 256,
                        "block_n": 32,
                        "block_k": 64,
                        "num_warps": 8,
                        "num_ctas": 1,
                        "num_stages": 3,
                        "split_k": 4
                    },
                    "64": {
                        "block_m": 256,
                        "block_n": 64,
                        "block_k": 32,
                        "num_warps": 8,
                        "num_ctas": 1,
                        "num_stages": 4,
                        "split_k": 4
                    },
                    "16": {
                        "block_m": 256,
                        "block_n": 32,
                        "block_k": 64,
                        "num_warps": 8,
                        "num_ctas": 1,
                        "num_stages": 3,
                        "split_k": 4
                    },
                    "128": {
                        "block_m": 256,
                        "block_n": 32,
                        "block_k": 64,
                        "num_warps": 8,
                        "num_ctas": 1,
                        "num_stages": 3,
                        "split_k": 4
                    }
                }
            },
            "8192": {
                "5120": {
                    "32": {
                        "block_m": 256,
                        "block_n": 32,
                        "block_k": 64,
                        "num_warps": 8,
                        "num_ctas": 1,
                        "num_stages": 3,
                        "split_k": 4
                    },
                    "64": {
                        "block_m": 256,
                        "block_n": 64,
                        "block_k": 32,
                        "num_warps": 8,
                        "num_ctas": 1,
                        "num_stages": 5,
                        "split_k": 4
                    },
                    "16": {
                        "block_m": 256,
                        "block_n": 32,
                        "block_k": 64,
                        "num_warps": 8,
                        "num_ctas": 1,
                        "num_stages": 3,
                        "split_k": 4
                    },
                    "128": {
                        "block_m": 256,
                        "block_n": 32,
                        "block_k": 64,
                        "num_warps": 8,
                        "num_ctas": 1,
                        "num_stages": 3,
                        "split_k": 4
                    }
                }
            },
            "10240": {
                "5120": {
                    "32": {
                        "block_m": 128,
                        "block_n": 32,
                        "block_k": 128,
                        "num_warps": 8,
                        "num_ctas": 1,
                        "num_stages": 3,
                        "split_k": 4
                    },
                    "64": {
                        "block_m": 128,
                        "block_n": 32,
                        "block_k": 64,
                        "num_warps": 4,
                        "num_ctas": 1,
                        "num_stages": 3,
                        "split_k": 4
                    },
                    "16": {
                        "block_m": 128,
                        "block_n": 32,
                        "block_k": 32,
                        "num_warps": 4,
                        "num_ctas": 1,
                        "num_stages": 4,
                        "split_k": 4
                    },
                    "128": {
                        "block_m": 128,
                        "block_n": 64,
                        "block_k": 64,
                        "num_warps": 4,
                        "num_ctas": 1,
                        "num_stages": 3,
                        "split_k": 4
                    }
                }
            }
        },
        "3": {
            "1": {
                "5120": {
                    "32": {
                        "block_m": 16,
                        "block_n": 32,
                        "block_k": 32,
                        "num_warps": 4,
                        "num_ctas": 1,
                        "num_stages": 3,
                        "split_k": 64
                    },
                    "64": {
                        "block_m": 16,
                        "block_n": 32,
                        "block_k": 64,
                        "num_warps": 4,
                        "num_ctas": 1,
                        "num_stages": 2,
                        "split_k": 32
                    },
                    "16": {
                        "block_m": 16,
                        "block_n": 32,
                        "block_k": 32,
                        "num_warps": 4,
                        "num_ctas": 1,
                        "num_stages": 4,
                        "split_k": 64
                    },
                    "128": {
                        "block_m": 16,
                        "block_n": 32,
                        "block_k": 32,
                        "num_warps": 4,
                        "num_ctas": 1,
                        "num_stages": 3,
                        "split_k": 32
                    },
                    "8": {
                        "block_m": 16,
                        "block_n": 32,
                        "block_k": 32,
                        "num_warps": 4,
                        "num_ctas": 1,
                        "num_stages": 4,
                        "split_k": 64
                    }
                }
            },
            "2": {
                "5120": {
                    "32": {
                        "block_m": 16,
                        "block_n": 32,
                        "block_k": 32,
                        "num_warps": 4,
                        "num_ctas": 1,
                        "num_stages": 3,
                        "split_k": 64
                    },
                    "64": {
                        "block_m": 16,
                        "block_n": 32,
                        "block_k": 32,
                        "num_warps": 4,
                        "num_ctas": 1,
                        "num_stages": 5,
                        "split_k": 32
                    },
                    "16": {
                        "block_m": 16,
                        "block_n": 32,
                        "block_k": 32,
                        "num_warps": 4,
                        "num_ctas": 1,
                        "num_stages": 4,
                        "split_k": 64
                    },
                    "128": {
                        "block_m": 16,
                        "block_n": 64,
                        "block_k": 64,
                        "num_warps": 8,
                        "num_ctas": 1,
                        "num_stages": 3,
                        "split_k": 16
                    },
                    "8": {
                        "block_m": 16,
                        "block_n": 32,
                        "block_k": 32,
                        "num_warps": 4,
                        "num_ctas": 1,
                        "num_stages": 3,
                        "split_k": 64
                    }
                }
            },
            "4": {
                "5120": {
                    "32": {
                        "block_m": 16,
                        "block_n": 32,
                        "block_k": 32,
                        "num_warps": 4,
                        "num_ctas": 1,
                        "num_stages": 3,
                        "split_k": 32
                    },
                    "64": {
                        "block_m": 16,
                        "block_n": 32,
                        "block_k": 64,
                        "num_warps": 4,
                        "num_ctas": 1,
                        "num_stages": 3,
                        "split_k": 16
                    },
                    "16": {
                        "block_m": 16,
                        "block_n": 32,
                        "block_k": 32,
                        "num_warps": 4,
                        "num_ctas": 1,
                        "num_stages": 3,
                        "split_k": 32
                    },
                    "128": {
                        "block_m": 16,
                        "block_n": 64,
                        "block_k": 64,
                        "num_warps": 4,
                        "num_ctas": 1,
                        "num_stages": 5,
                        "split_k": 16
                    },
                    "8": {
                        "block_m": 16,
                        "block_n": 32,
                        "block_k": 32,
                        "num_warps": 4,
                        "num_ctas": 1,
                        "num_stages": 3,
                        "split_k": 32
                    }
                }
            },
            "8": {
                "5120": {
                    "32": {
                        "block_m": 16,
                        "block_n": 32,
                        "block_k": 64,
                        "num_warps": 4,
                        "num_ctas": 1,
                        "num_stages": 3,
                        "split_k": 16
                    },
                    "64": {
                        "block_m": 16,
                        "block_n": 64,
                        "block_k": 32,
                        "num_warps": 4,
                        "num_ctas": 1,
                        "num_stages": 5,
                        "split_k": 32
                    },
                    "16": {
                        "block_m": 16,
                        "block_n": 32,
                        "block_k": 32,
                        "num_warps": 4,
                        "num_ctas": 1,
                        "num_stages": 4,
                        "split_k": 16
                    },
                    "128": {
                        "block_m": 16,
                        "block_n": 64,
                        "block_k": 64,
                        "num_warps": 4,
                        "num_ctas": 1,
                        "num_stages": 4,
                        "split_k": 8
                    },
                    "8": {
                        "block_m": 16,
                        "block_n": 32,
                        "block_k": 64,
                        "num_warps": 4,
                        "num_ctas": 1,
                        "num_stages": 3,
                        "split_k": 16
                    }
                }
            },
            "16": {
                "5120": {
                    "32": {
                        "block_m": 16,
                        "block_n": 32,
                        "block_k": 32,
                        "num_warps": 4,
                        "num_ctas": 1,
                        "num_stages": 3,
                        "split_k": 16
                    },
                    "64": {
                        "block_m": 16,
                        "block_n": 64,
                        "block_k": 64,
                        "num_warps": 4,
                        "num_ctas": 1,
                        "num_stages": 5,
                        "split_k": 8
                    },
                    "16": {
                        "block_m": 16,
                        "block_n": 32,
                        "block_k": 64,
                        "num_warps": 4,
                        "num_ctas": 1,
                        "num_stages": 4,
                        "split_k": 8
                    },
                    "128": {
                        "block_m": 16,
                        "block_n": 32,
                        "block_k": 256,
                        "num_warps": 4,
                        "num_ctas": 1,
                        "num_stages": 3,
                        "split_k": 4
                    },
                    "8": {
                        "block_m": 16,
                        "block_n": 32,
                        "block_k": 64,
                        "num_warps": 4,
                        "num_ctas": 1,
                        "num_stages": 4,
                        "split_k": 8
                    }
                }
            },
            "32": {
                "5120": {
                    "32": {
                        "block_m": 16,
                        "block_n": 32,
                        "block_k": 128,
                        "num_warps": 4,
                        "num_ctas": 1,
                        "num_stages": 2,
                        "split_k": 8
                    },
                    "64": {
                        "block_m": 32,
                        "block_n": 64,
                        "block_k": 64,
                        "num_warps": 4,
                        "num_ctas": 1,
                        "num_stages": 4,
                        "split_k": 8
                    },
                    "16": {
                        "block_m": 16,
                        "block_n": 32,
                        "block_k": 128,
                        "num_warps": 4,
                        "num_ctas": 1,
                        "num_stages": 2,
                        "split_k": 8
                    },
                    "128": {
                        "block_m": 16,
                        "block_n": 32,
                        "block_k": 256,
                        "num_warps": 4,
                        "num_ctas": 1,
                        "num_stages": 3,
                        "split_k": 4
                    },
                    "8": {
                        "block_m": 16,
                        "block_n": 32,
                        "block_k": 128,
                        "num_warps": 4,
                        "num_ctas": 1,
                        "num_stages": 3,
                        "split_k": 8
                    }
                }
            },
            "64": {
                "5120": {
                    "32": {
                        "block_m": 32,
                        "block_n": 32,
                        "block_k": 128,
                        "num_warps": 4,
                        "num_ctas": 1,
                        "num_stages": 3,
                        "split_k": 8
                    },
                    "64": {
                        "block_m": 64,
                        "block_n": 64,
                        "block_k": 64,
                        "num_warps": 4,
                        "num_ctas": 1,
                        "num_stages": 5,
                        "split_k": 8
                    },
                    "16": {
                        "block_m": 32,
                        "block_n": 32,
                        "block_k": 128,
                        "num_warps": 4,
                        "num_ctas": 1,
                        "num_stages": 3,
                        "split_k": 8
                    },
                    "128": {
                        "block_m": 16,
                        "block_n": 32,
                        "block_k": 256,
                        "num_warps": 4,
                        "num_ctas": 1,
                        "num_stages": 3,
                        "split_k": 4
                    },
                    "8": {
                        "block_m": 32,
                        "block_n": 32,
                        "block_k": 128,
                        "num_warps": 4,
                        "num_ctas": 1,
                        "num_stages": 2,
                        "split_k": 8
                    }
                }
            },
            "128": {
                "5120": {
                    "32": {
                        "block_m": 32,
                        "block_n": 32,
                        "block_k": 128,
                        "num_warps": 4,
                        "num_ctas": 1,
                        "num_stages": 3,
                        "split_k": 8
                    },
                    "64": {
                        "block_m": 64,
                        "block_n": 64,
                        "block_k": 64,
                        "num_warps": 4,
                        "num_ctas": 1,
                        "num_stages": 3,
                        "split_k": 8
                    },
                    "16": {
                        "block_m": 32,
                        "block_n": 32,
                        "block_k": 128,
                        "num_warps": 4,
                        "num_ctas": 1,
                        "num_stages": 2,
                        "split_k": 8
                    },
                    "128": {
                        "block_m": 32,
                        "block_n": 32,
                        "block_k": 256,
                        "num_warps": 4,
                        "num_ctas": 1,
                        "num_stages": 3,
                        "split_k": 4
                    },
                    "8": {
                        "block_m": 64,
                        "block_n": 32,
                        "block_k": 128,
                        "num_warps": 4,
                        "num_ctas": 1,
                        "num_stages": 3,
                        "split_k": 8
                    }
                }
            },
            "256": {
                "5120": {
                    "32": {
                        "block_m": 32,
                        "block_n": 32,
                        "block_k": 64,
                        "num_warps": 4,
                        "num_ctas": 1,
                        "num_stages": 2,
                        "split_k": 8
                    },
                    "64": {
                        "block_m": 64,
                        "block_n": 64,
                        "block_k": 64,
                        "num_warps": 4,
                        "num_ctas": 1,
                        "num_stages": 3,
                        "split_k": 8
                    },
                    "16": {
                        "block_m": 64,
                        "block_n": 32,
                        "block_k": 256,
                        "num_warps": 4,
                        "num_ctas": 1,
                        "num_stages": 3,
                        "split_k": 4
                    },
                    "128": {
                        "block_m": 32,
                        "block_n": 32,
                        "block_k": 256,
                        "num_warps": 4,
                        "num_ctas": 1,
                        "num_stages": 3,
                        "split_k": 4
                    },
                    "8": {
                        "block_m": 64,
                        "block_n": 32,
                        "block_k": 128,
                        "num_warps": 4,
                        "num_ctas": 1,
                        "num_stages": 3,
                        "split_k": 8
                    }
                }
            },
            "512": {
                "5120": {
                    "32": {
                        "block_m": 64,
                        "block_n": 32,
                        "block_k": 256,
                        "num_warps": 4,
                        "num_ctas": 1,
                        "num_stages": 2,
                        "split_k": 4
                    },
                    "64": {
                        "block_m": 64,
                        "block_n": 64,
                        "block_k": 128,
                        "num_warps": 4,
                        "num_ctas": 1,
                        "num_stages": 3,
                        "split_k": 4
                    },
                    "16": {
                        "block_m": 64,
                        "block_n": 32,
                        "block_k": 256,
                        "num_warps": 4,
                        "num_ctas": 1,
                        "num_stages": 3,
                        "split_k": 4
                    },
                    "128": {
                        "block_m": 64,
                        "block_n": 64,
                        "block_k": 32,
                        "num_warps": 4,
                        "num_ctas": 1,
                        "num_stages": 3,
                        "split_k": 4
                    },
                    "8": {
                        "block_m": 64,
                        "block_n": 32,
                        "block_k": 128,
                        "num_warps": 8,
                        "num_ctas": 1,
                        "num_stages": 3,
                        "split_k": 4
                    }
                }
            },
            "1024": {
                "5120": {
                    "32": {
                        "block_m": 64,
                        "block_n": 32,
                        "block_k": 256,
                        "num_warps": 4,
                        "num_ctas": 1,
                        "num_stages": 3,
                        "split_k": 4
                    },
                    "64": {
                        "block_m": 64,
                        "block_n": 64,
                        "block_k": 128,
                        "num_warps": 4,
                        "num_ctas": 1,
                        "num_stages": 3,
                        "split_k": 4
                    },
                    "16": {
                        "block_m": 64,
                        "block_n": 32,
                        "block_k": 256,
                        "num_warps": 4,
                        "num_ctas": 1,
                        "num_stages": 3,
                        "split_k": 4
                    },
                    "128": {
                        "block_m": 64,
                        "block_n": 64,
                        "block_k": 32,
                        "num_warps": 4,
                        "num_ctas": 1,
                        "num_stages": 5,
                        "split_k": 4
                    },
                    "8": {
                        "block_m": 64,
                        "block_n": 32,
                        "block_k": 128,
                        "num_warps": 8,
                        "num_ctas": 1,
                        "num_stages": 3,
                        "split_k": 4
                    }
                }
            },
            "1536": {
                "5120": {
                    "32": {
                        "block_m": 128,
                        "block_n": 32,
                        "block_k": 128,
                        "num_warps": 8,
                        "num_ctas": 1,
                        "num_stages": 3,
                        "split_k": 4
                    },
                    "64": {
                        "block_m": 128,
                        "block_n": 32,
                        "block_k": 64,
                        "num_warps": 4,
                        "num_ctas": 1,
                        "num_stages": 3,
                        "split_k": 4
                    },
                    "16": {
                        "block_m": 128,
                        "block_n": 32,
                        "block_k": 128,
                        "num_warps": 4,
                        "num_ctas": 1,
                        "num_stages": 3,
                        "split_k": 4
                    },
                    "128": {
                        "block_m": 128,
                        "block_n": 64,
                        "block_k": 64,
                        "num_warps": 4,
                        "num_ctas": 1,
                        "num_stages": 3,
                        "split_k": 4
                    },
                    "8": {
                        "block_m": 128,
                        "block_n": 32,
                        "block_k": 128,
                        "num_warps": 8,
                        "num_ctas": 1,
                        "num_stages": 3,
                        "split_k": 4
                    }
                }
            },
            "2048": {
                "5120": {
                    "32": {
                        "block_m": 128,
                        "block_n": 32,
                        "block_k": 128,
                        "num_warps": 8,
                        "num_ctas": 1,
                        "num_stages": 3,
                        "split_k": 4
                    },
                    "64": {
                        "block_m": 128,
                        "block_n": 32,
                        "block_k": 64,
                        "num_warps": 4,
                        "num_ctas": 1,
                        "num_stages": 3,
                        "split_k": 4
                    },
                    "16": {
                        "block_m": 128,
                        "block_n": 32,
                        "block_k": 128,
                        "num_warps": 8,
                        "num_ctas": 1,
                        "num_stages": 3,
                        "split_k": 4
                    },
                    "128": {
                        "block_m": 128,
                        "block_n": 64,
                        "block_k": 64,
                        "num_warps": 4,
                        "num_ctas": 1,
                        "num_stages": 3,
                        "split_k": 4
                    },
                    "8": {
                        "block_m": 128,
                        "block_n": 32,
                        "block_k": 128,
                        "num_warps": 8,
                        "num_ctas": 1,
                        "num_stages": 3,
                        "split_k": 4
                    }
                }
            },
            "4096": {
                "5120": {
                    "32": {
                        "block_m": 256,
                        "block_n": 32,
                        "block_k": 64,
                        "num_warps": 8,
                        "num_ctas": 1,
                        "num_stages": 3,
                        "split_k": 4
                    },
                    "64": {
                        "block_m": 256,
                        "block_n": 64,
                        "block_k": 32,
                        "num_warps": 8,
                        "num_ctas": 1,
                        "num_stages": 3,
                        "split_k": 4
                    },
                    "16": {
                        "block_m": 256,
                        "block_n": 32,
                        "block_k": 64,
                        "num_warps": 8,
                        "num_ctas": 1,
                        "num_stages": 3,
                        "split_k": 4
                    },
                    "128": {
                        "block_m": 256,
                        "block_n": 32,
                        "block_k": 64,
                        "num_warps": 8,
                        "num_ctas": 1,
                        "num_stages": 3,
                        "split_k": 4
                    },
                    "8": {
                        "block_m": 128,
                        "block_n": 32,
                        "block_k": 64,
                        "num_warps": 8,
                        "num_ctas": 1,
                        "num_stages": 3,
                        "split_k": 4
                    }
                }
            },
            "5120": {
                "5120": {
                    "32": {
                        "block_m": 128,
                        "block_n": 32,
                        "block_k": 128,
                        "num_warps": 8,
                        "num_ctas": 1,
                        "num_stages": 3,
                        "split_k": 4
                    },
                    "64": {
                        "block_m": 128,
                        "block_n": 32,
                        "block_k": 64,
                        "num_warps": 4,
                        "num_ctas": 1,
                        "num_stages": 3,
                        "split_k": 4
                    },
                    "16": {
                        "block_m": 128,
                        "block_n": 32,
                        "block_k": 32,
                        "num_warps": 4,
                        "num_ctas": 1,
                        "num_stages": 4,
                        "split_k": 4
                    },
                    "128": {
                        "block_m": 128,
                        "block_n": 64,
                        "block_k": 64,
                        "num_warps": 4,
                        "num_ctas": 1,
                        "num_stages": 3,
                        "split_k": 4
                    },
                    "8": {
                        "block_m": 128,
                        "block_n": 32,
                        "block_k": 64,
                        "num_warps": 8,
                        "num_ctas": 1,
                        "num_stages": 3,
                        "split_k": 4
                    }
                }
            },
            "6144": {
                "5120": {
                    "32": {
                        "block_m": 128,
                        "block_n": 32,
                        "block_k": 128,
                        "num_warps": 8,
                        "num_ctas": 1,
                        "num_stages": 3,
                        "split_k": 4
                    },
                    "64": {
                        "block_m": 128,
                        "block_n": 32,
                        "block_k": 64,
                        "num_warps": 4,
                        "num_ctas": 1,
                        "num_stages": 3,
                        "split_k": 4
                    },
                    "16": {
                        "block_m": 128,
                        "block_n": 32,
                        "block_k": 32,
                        "num_warps": 4,
                        "num_ctas": 1,
                        "num_stages": 3,
                        "split_k": 4
                    },
                    "128": {
                        "block_m": 128,
                        "block_n": 64,
                        "block_k": 64,
                        "num_warps": 4,
                        "num_ctas": 1,
                        "num_stages": 3,
                        "split_k": 4
                    },
                    "8": {
                        "block_m": 128,
                        "block_n": 32,
                        "block_k": 64,
                        "num_warps": 8,
                        "num_ctas": 1,
                        "num_stages": 4,
                        "split_k": 4
                    }
                }
            },
            "7168": {
                "5120": {
                    "32": {
                        "block_m": 256,
                        "block_n": 32,
                        "block_k": 32,
                        "num_warps": 4,
                        "num_ctas": 1,
                        "num_stages": 3,
                        "split_k": 4
                    },
                    "64": {
                        "block_m": 128,
                        "block_n": 32,
                        "block_k": 64,
                        "num_warps": 4,
                        "num_ctas": 1,
                        "num_stages": 3,
                        "split_k": 4
                    },
                    "16": {
                        "block_m": 256,
                        "block_n": 32,
                        "block_k": 32,
                        "num_warps": 4,
                        "num_ctas": 1,
                        "num_stages": 4,
                        "split_k": 4
                    },
                    "128": {
                        "block_m": 256,
                        "block_n": 32,
                        "block_k": 64,
                        "num_warps": 8,
                        "num_ctas": 1,
                        "num_stages": 3,
                        "split_k": 4
                    },
                    "8": {
                        "block_m": 128,
                        "block_n": 32,
                        "block_k": 64,
                        "num_warps": 8,
                        "num_ctas": 1,
                        "num_stages": 4,
                        "split_k": 4
                    }
                }
            },
            "8192": {
                "5120": {
                    "32": {
                        "block_m": 256,
                        "block_n": 32,
                        "block_k": 32,
                        "num_warps": 4,
                        "num_ctas": 1,
                        "num_stages": 4,
                        "split_k": 4
                    },
                    "64": {
                        "block_m": 128,
                        "block_n": 32,
                        "block_k": 64,
                        "num_warps": 4,
                        "num_ctas": 1,
                        "num_stages": 3,
                        "split_k": 4
                    },
                    "16": {
                        "block_m": 256,
                        "block_n": 32,
                        "block_k": 32,
                        "num_warps": 4,
                        "num_ctas": 1,
                        "num_stages": 3,
                        "split_k": 4
                    },
                    "128": {
                        "block_m": 256,
                        "block_n": 32,
                        "block_k": 64,
                        "num_warps": 8,
                        "num_ctas": 1,
                        "num_stages": 3,
                        "split_k": 4
                    },
                    "8": {
                        "block_m": 128,
                        "block_n": 32,
                        "block_k": 64,
                        "num_warps": 8,
                        "num_ctas": 1,
                        "num_stages": 3,
                        "split_k": 4
                    }
                }
            },
            "10240": {
                "5120": {
                    "32": {
                        "block_m": 128,
                        "block_n": 32,
                        "block_k": 128,
                        "num_warps": 8,
                        "num_ctas": 1,
                        "num_stages": 3,
                        "split_k": 4
                    },
                    "64": {
                        "block_m": 128,
                        "block_n": 32,
                        "block_k": 64,
                        "num_warps": 4,
                        "num_ctas": 1,
                        "num_stages": 3,
                        "split_k": 4
                    },
                    "16": {
                        "block_m": 128,
                        "block_n": 32,
                        "block_k": 64,
                        "num_warps": 8,
                        "num_ctas": 1,
                        "num_stages": 3,
                        "split_k": 4
                    },
                    "128": {
                        "block_m": 128,
                        "block_n": 64,
                        "block_k": 64,
                        "num_warps": 8,
                        "num_ctas": 1,
                        "num_stages": 3,
                        "split_k": 4
                    },
                    "8": {
                        "block_m": 128,
                        "block_n": 32,
                        "block_k": 64,
                        "num_warps": 4,
                        "num_ctas": 1,
                        "num_stages": 3,
                        "split_k": 4
                    }
                }
            }
        }
    }
}
