vllm/lora/ops/triton_ops/configs/120B/NVIDIA_H200_SHRINK.json
{
    "16": {
        "1": {
            "1": {
                "1024": {
                    "16": {
                        "block_m": 16,
                        "block_n": 32,
                        "block_k": 32,
                        "num_warps": 4,
                        "num_stages": 3,
                        "split_k": 32
                    }
                },
                "2048": {
                    "16": {
                        "block_m": 16,
                        "block_n": 32,
                        "block_k": 32,
                        "num_warps": 4,
                        "num_stages": 4,
                        "split_k": 64
                    }
                },
                "2880": {
                    "16": {
                        "block_m": 16,
                        "block_n": 32,
                        "block_k": 64,
                        "num_warps": 4,
                        "num_stages": 4,
                        "split_k": 64
                    }
                }
            },
            "8": {
                "1024": {
                    "16": {
                        "block_m": 16,
                        "block_n": 32,
                        "block_k": 32,
                        "num_warps": 4,
                        "num_stages": 2,
                        "split_k": 32
                    }
                },
                "2048": {
                    "16": {
                        "block_m": 16,
                        "block_n": 32,
                        "block_k": 32,
                        "num_warps": 4,
                        "num_stages": 2,
                        "split_k": 32
                    }
                },
                "2880": {
                    "16": {
                        "block_m": 16,
                        "block_n": 32,
                        "block_k": 32,
                        "num_warps": 4,
                        "num_stages": 2,
                        "split_k": 32
                    }
                }
            },
            "16": {
                "1024": {
                    "16": {
                        "block_m": 16,
                        "block_n": 32,
                        "block_k": 32,
                        "num_warps": 4,
                        "num_stages": 2,
                        "split_k": 16
                    }
                },
                "2048": {
                    "16": {
                        "block_m": 16,
                        "block_n": 32,
                        "block_k": 32,
                        "num_warps": 4,
                        "num_stages": 4,
                        "split_k": 16
                    }
                },
                "2880": {
                    "16": {
                        "block_m": 16,
                        "block_n": 32,
                        "block_k": 32,
                        "num_warps": 4,
                        "num_stages": 5,
                        "split_k": 16
                    }
                }
            }
        },
        "2": {
            "1": {
                "1024": {
                    "16": {
                        "block_m": 16,
                        "block_n": 32,
                        "block_k": 32,
                        "num_warps": 4,
                        "num_stages": 3,
                        "split_k": 32
                    }
                },
                "2048": {
                    "16": {
                        "block_m": 16,
                        "block_n": 32,
                        "block_k": 32,
                        "num_warps": 4,
                        "num_stages": 3,
                        "split_k": 64
                    }
                },
                "2880": {
                    "16": {
                        "block_m": 16,
                        "block_n": 32,
                        "block_k": 32,
                        "num_warps": 4,
                        "num_stages": 3,
                        "split_k": 64
                    }
                }
            },
            "8": {
                "1024": {
                    "16": {
                        "block_m": 16,
                        "block_n": 32,
                        "block_k": 32,
                        "num_warps": 4,
                        "num_stages": 3,
                        "split_k": 16
                    }
                },
                "2048": {
                    "16": {
                        "block_m": 16,
                        "block_n": 32,
                        "block_k": 32,
                        "num_warps": 4,
                        "num_stages": 3,
                        "split_k": 16
                    }
                },
                "2880": {
                    "16": {
                        "block_m": 16,
                        "block_n": 32,
                        "block_k": 256,
                        "num_warps": 4,
                        "num_stages": 2,
                        "split_k": 16
                    }
                }
            },
            "16": {
                "1024": {
                    "16": {
                        "block_m": 16,
                        "block_n": 32,
                        "block_k": 64,
                        "num_warps": 4,
                        "num_stages": 3,
                        "split_k": 8
                    }
                },
                "2048": {
                    "16": {
                        "block_m": 16,
                        "block_n": 32,
                        "block_k": 64,
                        "num_warps": 4,
                        "num_stages": 5,
                        "split_k": 8
                    }
                },
                "2880": {
                    "16": {
                        "block_m": 16,
                        "block_n": 32,
                        "block_k": 64,
                        "num_warps": 4,
                        "num_stages": 5,
                        "split_k": 8
                    }
                }
            }
        },
        "3": {
            "1": {
                "1024": {
                    "16": {
                        "block_m": 16,
                        "block_n": 32,
                        "block_k": 32,
                        "num_warps": 4,
                        "num_stages": 2,
                        "split_k": 32
                    }
                },
                "2048": {
                    "16": {
                        "block_m": 16,
                        "block_n": 32,
                        "block_k": 32,
                        "num_warps": 4,
                        "num_stages": 3,
                        "split_k": 64
                    }
                },
                "2880": {
                    "16": {
                        "block_m": 16,
                        "block_n": 32,
                        "block_k": 32,
                        "num_warps": 4,
                        "num_stages": 3,
                        "split_k": 64
                    }
                }
            },
            "8": {
                "1024": {
                    "16": {
                        "block_m": 16,
                        "block_n": 32,
                        "block_k": 32,
                        "num_warps": 4,
                        "num_stages": 5,
                        "split_k": 16
                    }
                },
                "2048": {
                    "16": {
                        "block_m": 16,
                        "block_n": 32,
                        "block_k": 32,
                        "num_warps": 4,
                        "num_stages": 5,
                        "split_k": 16
                    }
                },
                "2880": {
                    "16": {
                        "block_m": 16,
                        "block_n": 32,
                        "block_k": 128,
                        "num_warps": 4,
                        "num_stages": 3,
                        "split_k": 8
                    }
                }
            },
            "16": {
                "1024": {
                    "16": {
                        "block_m": 16,
                        "block_n": 32,
                        "block_k": 32,
                        "num_warps": 4,
                        "num_stages": 3,
                        "split_k": 8
                    }
                },
                "2048": {
                    "16": {
                        "block_m": 16,
                        "block_n": 32,
                        "block_k": 64,
                        "num_warps": 4,
                        "num_stages": 4,
                        "split_k": 8
                    }
                },
                "2880": {
                    "16": {
                        "block_m": 16,
                        "block_n": 32,
                        "block_k": 64,
                        "num_warps": 4,
                        "num_stages": 4,
                        "split_k": 8
                    }
                }
            }
        }
    }
}
