vllm/lora/ops/triton_ops/configs/120B/NVIDIA_H200_EXPAND_TRUE.json
{
    "16": {
        "1": {
            "1": {
                "16": {
                    "1024": {
                        "block_m": 16,
                        "block_n": 32,
                        "block_k": 32,
                        "num_warps": 4,
                        "num_stages": 2
                    },
                    "2048": {
                        "block_m": 16,
                        "block_n": 64,
                        "block_k": 32,
                        "num_warps": 4,
                        "num_stages": 3
                    },
                    "2880": {
                        "block_m": 16,
                        "block_n": 64,
                        "block_k": 32,
                        "num_warps": 4,
                        "num_stages": 2
                    }
                }
            },
            "8": {
                "16": {
                    "1024": {
                        "block_m": 16,
                        "block_n": 128,
                        "block_k": 32,
                        "num_warps": 8,
                        "num_stages": 2
                    },
                    "2048": {
                        "block_m": 16,
                        "block_n": 128,
                        "block_k": 32,
                        "num_warps": 8,
                        "num_stages": 2
                    },
                    "2880": {
                        "block_m": 16,
                        "block_n": 256,
                        "block_k": 32,
                        "num_warps": 4,
                        "num_stages": 2
                    }
                }
            },
            "16": {
                "16": {
                    "1024": {
                        "block_m": 16,
                        "block_n": 128,
                        "block_k": 32,
                        "num_warps": 8,
                        "num_stages": 2
                    },
                    "2048": {
                        "block_m": 16,
                        "block_n": 256,
                        "block_k": 32,
                        "num_warps": 4,
                        "num_stages": 2
                    },
                    "2880": {
                        "block_m": 16,
                        "block_n": 256,
                        "block_k": 32,
                        "num_warps": 4,
                        "num_stages": 2
                    }
                }
            }
        },
        "2": {
            "1": {
                "16": {
                    "1024": {
                        "block_m": 16,
                        "block_n": 32,
                        "block_k": 32,
                        "num_warps": 8,
                        "num_stages": 3
                    },
                    "2048": {
                        "block_m": 16,
                        "block_n": 32,
                        "block_k": 32,
                        "num_warps": 8,
                        "num_stages": 2
                    },
                    "2880": {
                        "block_m": 16,
                        "block_n": 32,
                        "block_k": 32,
                        "num_warps": 8,
                        "num_stages": 2
                    }
                }
            },
            "8": {
                "16": {
                    "1024": {
                        "block_m": 16,
                        "block_n": 64,
                        "block_k": 32,
                        "num_warps": 4,
                        "num_stages": 2
                    },
                    "2048": {
                        "block_m": 16,
                        "block_n": 64,
                        "block_k": 32,
                        "num_warps": 4,
                        "num_stages": 4
                    },
                    "2880": {
                        "block_m": 16,
                        "block_n": 128,
                        "block_k": 32,
                        "num_warps": 4,
                        "num_stages": 2
                    }
                }
            },
            "16": {
                "16": {
                    "1024": {
                        "block_m": 16,
                        "block_n": 128,
                        "block_k": 32,
                        "num_warps": 4,
                        "num_stages": 3
                    },
                    "2048": {
                        "block_m": 16,
                        "block_n": 256,
                        "block_k": 32,
                        "num_warps": 4,
                        "num_stages": 2
                    },
                    "2880": {
                        "block_m": 16,
                        "block_n": 128,
                        "block_k": 32,
                        "num_warps": 4,
                        "num_stages": 3
                    }
                }
            }
        },
        "3": {
            "1": {
                "16": {
                    "1024": {
                        "block_m": 16,
                        "block_n": 32,
                        "block_k": 32,
                        "num_warps": 8,
                        "num_stages": 2
                    },
                    "2048": {
                        "block_m": 16,
                        "block_n": 32,
                        "block_k": 32,
                        "num_warps": 8,
                        "num_stages": 2
                    },
                    "2880": {
                        "block_m": 16,
                        "block_n": 64,
                        "block_k": 32,
                        "num_warps": 8,
                        "num_stages": 2
                    }
                }
            },
            "8": {
                "16": {
                    "1024": {
                        "block_m": 16,
                        "block_n": 256,
                        "block_k": 32,
                        "num_warps": 8,
                        "num_stages": 3
                    },
                    "2048": {
                        "block_m": 16,
                        "block_n": 128,
                        "block_k": 32,
                        "num_warps": 4,
                        "num_stages": 2
                    },
                    "2880": {
                        "block_m": 16,
                        "block_n": 128,
                        "block_k": 32,
                        "num_warps": 4,
                        "num_stages": 5
                    }
                }
            },
            "16": {
                "16": {
                    "1024": {
                        "block_m": 16,
                        "block_n": 128,
                        "block_k": 32,
                        "num_warps": 4,
                        "num_stages": 2
                    },
                    "2048": {
                        "block_m": 16,
                        "block_n": 128,
                        "block_k": 32,
                        "num_warps": 4,
                        "num_stages": 3
                    },
                    "2880": {
                        "block_m": 16,
                        "block_n": 128,
                        "block_k": 32,
                        "num_warps": 4,
                        "num_stages": 2
                    }
                }
            }
        }
    }
}
